1A," Item 1A. Risk Factors: 

&#160; Downturn in Economic Environment and Client Spending Budgets could impact the Company's Business: If overall demand for IBM's products and solutions decreases, whether due to general economic conditions or a shift in client buying patterns, the company's revenue and profit could be impacted. 

&#160; The Company may not meet its Growth and Productivity Objectives under its Internal Business Transformation and Global Integration Initiatives: On an ongoing basis, IBM seeks to drive greater agility, productivity, flexibility and cost savings by transforming and globally integrating its own business processes and functions to remain competitive and to enable scaling of resources and offerings in both emerging and more established markets. These various initiatives may not yield their intended gains in speed, quality, productivity and enablement of rapid scaling, which may impact the company's competitiveness and its ability to meet its growth and productivity objectives. 

&#160; Failure of Innovation Initiatives could impact the Long-Term Success of the Company: IBM has been moving away from certain segments of the IT industry and into areas in which it can differentiate itself through innovation and by leveraging its investments in R&#38;D. If IBM is unable to continue its cutting-edge innovation in a highly competitive environment or is unable to commercialize such innovations, expand and scale them with sufficient speed, the company could fail in its ongoing efforts to maintain and increase its market share and its profit margins. In addition, IBM has one of the strongest brand names in the world, and its brand and overall reputation could be negatively impacted by many factors, including if the company does not continue to be recognized for its industry-leading technology and solutions. If the company's brand image is tarnished by negative perceptions, its ability to attract and retain customers could be impacted. 

&#160; Risks from Investing in Growth Opportunities could impact the Company's Business: The company continues to invest significantly in its strategic imperatives to drive revenue growth and market share gains. Client adoption rates and viable economic models are less certain in the high-value, highly competitive, and rapidly-growing segments, and new delivery models may unfavorably impact demand and profitability for our other products or services. In addition, as the company expands to capture emerging growth opportunities, it needs to rapidly secure the appropriate mix of trained, skilled and experienced personnel, and develop ecosystems and collaborative partnerships. In emerging growth countries, the developing nature presents potential political, social, legal and economic risks from evolving governmental policy, inadequate infrastructure, creditworthiness of customers and business partners, labor disruption and corruption, which could impact the company's ability to meet its growth objectives and to deliver to its clients around the world. 

&#160; IBM's Intellectual Property Portfolio may not prevent Competitive Offerings, and IBM may not be able to Obtain Necessary Licenses: The company's patents and other intellectual property may not prevent competitors from independently developing products and services similar to or duplicative to the company's, nor can there be any assurance that the resources invested by the company to protect its intellectual property will be sufficient or that the company's intellectual property portfolio will adequately deter misappropriation or improper use of the company's technology. In addition, the company may be the target of aggressive and opportunistic enforcement of patents by third parties, including non-practicing entities. Also, there can be no assurances that IBM will be able to obtain from third parties the licenses it needs in the future. The company's ability to protect its intellectual property 

could also be impacted by changes to existing laws, legal principles and regulations governing intellectual property, including the ownership and protection of patents. 

&#160; Cybersecurity and Privacy Considerations could impact the Company's Business: The company's products, services, and systems may affect critical third party operations or involve the storage, processing and transmission of proprietary information and sensitive or confidential data, including valuable intellectual property and personal information of employees, customers and others. In the current environment there are numerous and evolving risks to cybersecurity and privacy, including criminal hackers, hacktivists, state-sponsored intrusions, industrial espionage, employee malfeasance, and human or technological error. Computer hackers and others routinely attempt to breach the security of technology products, services, and systems, and those of customers, third-parties contractors and vendors. Successful breaches could result in, for example, unauthorized access to, disclosure, modification, misuse, loss, or destruction of company, customer, or other third party data or systems, theft of sensitive or confidential data including personal information and intellectual property, system disruptions, and denial of service. In the event of such breaches, the company, its customers or other third parties could be exposed to potential liability, litigation, and regulatory action, as well as the loss of existing or potential customers, damage to brand and reputation, and other financial loss. In addition, the cost and operational consequences of responding to breaches and implementing remediation measures could be significant. The company experiences and responds to cybersecurity threats, although none has had a material adverse effect on the company to date. As these threats develop and grow, the company may also find it necessary to make significant further investments to protect data and infrastructure. As a global enterprise, the company could also be impacted by existing and proposed laws and regulations, as well as government policies and practices related to cybersecurity, privacy, data localization and data protection. Additionally, cyber attacks or other catastrophic events resulting in disruptions to or failures in power, information technology, communication systems or other critical infrastructure could result in interruptions or delays to company, customer, or other third party operations or services, financial loss, potential liability, and damage to brand and reputation. 

&#160; The Company's Financial Results for Particular Periods are Difficult to Predict: IBM's revenues are affected by such factors as the introduction of new products and services, the length of the sales cycles and the seasonality of technology purchases. Moreover, the company's strategic imperatives involve new products, new customers, and new markets, all of which contribute to the difficulty of predicting the company's financial results. The company's financial results may also be impacted by the structure of products and services contracts and the nature of its customers' businesses; for example, certain of the company's services contracts with commercial customers in regulated industries are subject to periodic review by regulators with respect to controls and processes. As a result of the above-mentioned factors, the company's financial results are difficult to predict. Historically, the company has had lower revenue in the first quarter than in the immediately preceding fourth quarter. In addition, the high volume of products typically ordered at the end of each quarter, especially at the end of the fourth quarter, may affect IBM's ability to successfully ship all orders before the end of the quarter. 

&#160; Due to the Company's Global Presence, its Business and Operations could be impacted by Local Legal, Economic, Political and Health Conditions: The company is a globally integrated entity, operating in over 175 countries worldwide and deriving more than sixty percent of its revenues from sales outside the United States. Changes in the laws or policies of the countries in which the company operates, or inadequate enforcement of laws or policies, could affect the company's business and the company's overall results of operations. The company's results of operations also could be affected by economic and political changes in those countries and by macroeconomic changes, including recessions, inflation and currency fluctuations between the U.S. dollar and non-U.S. currencies. Further, as the company expands its customer base and the scope of its offerings, both within the U.S. and globally, it may be impacted by additional regulatory or other risks. In addition, any widespread outbreak of an illness, 

pandemic or other local or global health issue or uncertain political climates, international hostilities, natural disasters, or any terrorist activities, could adversely affect customer demand and the company's operations and its ability to source and deliver products and services to its customers. 

&#160; The Company could incur Substantial Costs for Environmental Matters: The company is subject to various federal, state, local and foreign laws and regulations concerning the discharge of materials into the environment or otherwise related to environmental protection, including the U.S. Superfund law. The company could incur substantial costs, including cleanup costs, fines and civil or criminal sanctions, as well as third-party claims for property damage or personal injury, if it were to violate or become liable under environmental laws and regulations. Compliance with environmental laws and regulations is not expected to have a material adverse effect on the company's financial position, results of operations and competitive position. 

&#160; Tax Matters could impact the Company's Results of Operations and Financial Condition: The company is subject to income taxes in both the United States and numerous foreign jurisdictions. IBM's provision for income taxes and cash tax liability in the future could be adversely affected by numerous factors including, but not limited to, income before taxes being lower than anticipated in countries with lower statutory tax rates and higher than anticipated in countries with higher statutory tax rates, changes in the valuation of deferred tax assets and liabilities, and changes in tax laws, regulations, accounting principles or interpretations thereof, which could adversely impact the company's results of operations and financial condition in future periods. In addition, IBM is subject to the continuous examination of its income tax returns by the United States Internal Revenue Service and other tax authorities around the world. The company regularly assesses the likelihood of adverse outcomes resulting from these examinations to determine the adequacy of its provision for income taxes. There can be no assurance that the outcomes from these continuous examinations will not have an adverse effect on the company's provision for income taxes and cash tax liability. 

&#160; The Company's Results of Operations and Financial Condition could be negatively impacted by its U.S. and non-U.S. Pension Plans: Adverse equity market conditions and volatility in the credit markets may have an unfavorable impact on the value of the company's pension trust assets and its future estimated pension liabilities. As a result, the company's financial results in any period could be negatively impacted. In addition, in a period of an extended financial market downturn, the company could be required to provide incremental pension plan funding with resulting liquidity risk which could negatively impact the company's financial flexibility. Further, the company's results of operations and financial results could be negatively impacted by premiums for mandatory pension insolvency insurance coverage outside the United States. Premium increases can be significant due to the level of insolvencies of unrelated companies in the country at issue. Currently, Canada, Germany, Luxembourg and the United Kingdom require that these premiums be paid directly by the company and not out of plan assets, which could negatively impact the company's earnings. IBM's 2014 Annual Report to Stockholders includes information about potential impacts from pension funding and the use of certain assumptions regarding pension matters. 

&#160; Ineffective Internal Controls could impact the Company's Business and Operating Results: The company's internal control over financial reporting may not prevent or detect misstatements because of its inherent limitations, including the possibility of human error, the circumvention or overriding of controls, or fraud. Even effective internal controls can provide only reasonable assurance with respect to the preparation and fair presentation of financial statements. If the company fails to maintain the adequacy of its internal controls, including any failure to implement required new or improved controls, or if the company experiences difficulties in their implementation, the company's business and operating results could be harmed and the company could fail to meet its financial reporting obligations. 

&#160; The Company's Use of Accounting Estimates involves Judgment and could impact the Company's Financial Results: The application of generally accepted accounting principles requires the company to make estimates and assumptions about certain items and future events that directly affect its reported financial condition. The company's most critical accounting estimates are described in the Management Discussion in IBM's 2014 Annual Report to Stockholders, under ""Critical Accounting Estimates."" In addition, as discussed in note M, ""Contingencies and Commitments,"" in IBM's 2014 Annual Report to Stockholders, the company makes certain estimates including decisions related to legal proceedings and reserves. These estimates and assumptions involve the use of judgment. As a result, actual financial results may differ. 

&#160; The Company Depends on Skilled Personnel and could be impacted by the loss of Critical Skills: Much of the future success of the company depends on the continued service, availability and integrity of skilled personnel, including technical, marketing and staff resources. Skilled and experienced personnel in the areas where the company competes are in high demand, and competition for their talents is intense. Changing demographics and labor work force trends may result in a loss of knowledge and skills as experienced workers leave the company. In addition, as global opportunities and industry demand shifts, realignment, training and scaling of skilled resources may not be sufficiently rapid. Further, many of IBM's key personnel receive a total compensation package that includes equity awards. New regulations, volatility in the stock market and other factors could diminish the company's use, and the value, of the company's equity awards, putting the company at a competitive disadvantage or forcing the company to use more cash compensation. 

&#160; The Company's Business could be impacted by its Relationships with Critical Suppliers: IBM's business employs a wide variety of components, supplies, services and raw materials from a substantial number of suppliers around the world. Certain of the company's businesses rely on a single or a limited number of suppliers, and after GLOBALFOUNDRIES completes the acquisition of IBM's global commercial semiconductor business, it will become IBM's exclusive server processor technology provider for certain semiconductors. Changes in the business condition (financial or otherwise) of these suppliers could subject the company to losses and affect its ability to bring products to market. Further, the failure of the company's suppliers to deliver components, supplies, services and raw materials in sufficient quantities, in a timely manner, and in compliance with all applicable laws and regulations could adversely affect the company's business. In addition, any defective components, supplies or materials, or inadequate services received from suppliers could reduce the reliability of the company's products and services and harm the company's reputation. 

&#160; The Company could be impacted by its Business with Government Clients: The company's customers include numerous governmental entities within and outside the U.S., including the U.S. Federal Government and state and local entities. Some of the company's agreements with these customers may be subject to periodic funding approval. Funding reductions or delays could adversely impact public sector demand for our products and services. Also, some agreements may contain provisions allowing the customer to terminate without cause and providing for higher liability limits for certain losses. In addition, the company could be suspended or debarred as a governmental contractor and could incur civil and criminal fines and penalties, which could negatively impact the company's results of operations and financial results. 

&#160; The Company is exposed to Currency and Customer Financing Risks that could impact its Revenue and Business: The company derives a significant percentage of its revenues and costs from its affiliates operating in local currency environments, and those results are affected by changes in the relative values of non-U.S. currencies and the U.S. dollar. Further, inherent in the company's customer financing business are risks related to the concentration of credit, client creditworthiness, interest rate and currency fluctuations on the associated debt and liabilities, the determination of residual values and the financing of other than traditional IT assets. The company employs a number of strategies to manage these risks, including the use of derivative financial instruments, which involve the risk of 

non-performance by the counterparty. In addition, there can be no assurance that the company's efforts to manage its currency and customer financing risks will be successful. 

&#160; The Company's Financial Performance could be impacted by Changes in Market Liquidity Conditions and by Customer Credit Risk on Receivables: The company's financial performance is exposed to a wide variety of industry sector dynamics worldwide. The company's earnings and cash flows, as well as its access to funding, could be negatively impacted by changes in market liquidity conditions. IBM's 2014 Annual Report to Stockholders includes information about the company's liquidity position. The company's client base includes many worldwide enterprises, from small and medium businesses to the world's largest organizations and governments, with a significant portion of the company's revenue coming from global clients across many sectors. Most of the company's sales are on an open credit basis, and the company performs ongoing credit evaluations of its clients' financial conditions. If the company becomes aware of information related to the creditworthiness of a major customer, or, if future actual default rates on receivables in general differ from those currently anticipated, the company may have to adjust its allowance for credit losses, which could affect the company's consolidated net income in the period the adjustments are made. 

&#160; The Company's Reliance on Third Party Distribution Channels could impact its Business: The company offers its products directly and through a variety of third party distributors and resellers. Changes in the business condition (financial or otherwise) of these distributors and resellers could subject the company to losses and affect its ability to bring its products to market. As the company moves into new areas, distributors and resellers may be unable to keep up with changes in technology and offerings, and the company may be unable to recruit and enable appropriate partners to achieve growth objectives. In addition, the failure of third party distributors and resellers to comply with all applicable laws and regulations may prevent the company from working with them and could subject the company to losses and affect its ability to bring products to market. 

&#160; Risks to the Company from Acquisitions, Alliances and Dispositions include Integration Challenges, Failure to Achieve Objectives, and the Assumption of Liabilities: The company has made and expects to continue to make acquisitions, alliances and dispositions. Acquisitions and alliances present significant challenges and risks relating to the integration of the business into the company, and there can be no assurances that the company will manage acquisitions and alliances successfully or that strategic acquisition opportunities will be available to the company on acceptable terms or at all. The related risks include the company failing to achieve strategic objectives and anticipated revenue improvements and cost savings, as well as the failure to retain key personnel of the acquired business and the assumption of liabilities related to litigation or other legal proceedings involving the acquired business. From time to time, the company disposes or attempts to dispose of assets that are no longer central to its strategic objectives. Any such disposition or attempted disposition is subject to risks, including risks related to the terms and timing of such disposition, risks related to obtaining necessary governmental or regulatory approvals and risks related to retained liabilities not subject to the company's control. 

&#160; The Company is Subject to Legal Proceedings Risks: As a company with a substantial employee population and with clients in more than 175 countries, IBM is involved, either as plaintiff or defendant, in a variety of ongoing claims, demands, suits, investigations, tax matters and proceedings that arise from time to time in the ordinary course of its business. The risks associated with such legal proceedings are described in more detail in note M, ""Contingencies and Commitments,"" in IBM's 2014 Annual Report to Stockholders. The company believes it has adopted appropriate risk management and compliance programs. Legal and compliance risks, however, will continue to exist and additional legal proceedings and other contingencies, the outcome of which cannot be predicted with certainty, may arise from time to time. 

&#160; Risk Factors Related to IBM Securities: The company and its subsidiaries issue debt securities in the worldwide capital markets from time to time, with a variety of different maturities and in different 

currencies. The value of the company's debt securities fluctuates based on many factors, including the methods employed for calculating principal and interest, the maturity of the securities, the aggregate principal amount of securities outstanding, the redemption features for the securities, the level, direction and volatility of interest rates, changes in exchange rates, exchange controls, governmental and stock exchange regulations and other factors over which the company has little or no control. The company's ability to pay interest and repay the principal for its debt securities is dependent upon its ability to manage its business operations, as well as the other risks described under this Item 1A. entitled ""Risk Factors."" There can be no assurance that the company will be able to manage any of these risks successfully. 

The company also issues its common stock from time to time in connection with various compensation plans, contributions to its pension plan and certain acquisitions. The market price of IBM common stock is subject to significant volatility, due to other factors described under this Item 1A. entitled ""Risk Factors,"" as well as economic and geopolitical conditions generally, trading volumes, speculation by the press or investment community about the company's financial condition, and other factors, many of which are beyond the company's control. Since the market price of IBM's common stock fluctuates significantly, stockholders may not be able to sell the company's stock at attractive prices. 

In addition, changes by any rating agency to the company's outlook or credit ratings can negatively impact the value and liquidity of both the company's debt and equity securities. The company does not make a market in either its debt or equity securities and cannot provide any assurances with respect to the liquidity or value of such securities. 

"
7A," Item 7A. Quantitative and Qualitative Disclosures About Market Risk: 

Refer to the section titled ""Market Risk"" on page 72 of IBM's 2014 Annual Report to Stockholders, which is incorporated herein by reference. 

"
8," Item 8. Financial Statements and Supplementary Data: 

Refer to pages 80 through 150 of IBM's 2014 Annual Report to Stockholders, which are incorporated herein by reference. Also refer to the Financial Statement Schedule on page S-1 of this Form 10-K. 

"
